{
  "ledger": "Open Accountability Ledger",
  "version": "0.2.0",
  "generated": "2026-07-18",
  "status": "build-phase demonstrator, internal, not for publication",
  "prepared_for": "Office of Bevan Eatts MLA (Nationals WA, Member for Warren-Blackwood)",
  "one_line": "One public, permanent, machine-readable register of what government was told, what it promised, and what it did.",
  "discipline": {
    "direction": "Radical transparency pointed upward at power, not downward at the public. Holds recommendations, not people.",
    "robodebt_guardrail": "No personal data, no algorithm over any citizen, no automated decision about anyone. The opposite of Robodebt, on purpose.",
    "enforcement": "Check the ledger before you write the cheque: any business case to commission external research/consultancy must first cite the ledger and show the question is genuinely unanswered, or state on the record why it departs from what was already recommended.",
    "honesty_rule": "Every figure carries a source and a confidence flag. Figures are never summed, each has its own source. Entries with status UNVERIFIED or confidence LOW are withheld from public use (public_use=false) and flagged HOLD."
  },
  "lens_order": [
    "A",
    "B",
    "C",
    "D"
  ],
  "lenses": {
    "A": {
      "name": "Open Recommendations",
      "blurb": "An inquiry or audit answer government was given, often paid for, and whether it was acted on."
    },
    "B": {
      "name": "They Were Warned",
      "blurb": "A documented warning, harm that followed, and the costly patch. Some entries are live and flagged unverified."
    },
    "C": {
      "name": "Consultation Integrity",
      "blurb": "A “we consulted” claim turned into a checkable record. Most WA cases here are not yet verified, shown honestly."
    },
    "D": {
      "name": "The Receipts",
      "blurb": "A specific consultant or IT-spend case, with the dollar figure and the outcome."
    }
  },
  "status_values": {
    "DONE": "Recommendation/commitment fully acted on.",
    "PARTIAL": "Partly acted on; material commitments still open.",
    "IGNORED": "Answer/warning on the record; not acted on.",
    "RECURRING": "The same failure or finding recurs year after year.",
    "OVERDUE": "Action required and past due.",
    "LIVE": "An open, ongoing matter that is verified but not yet decided; shown flagged, never as settled.",
    "UNVERIFIED": "Not yet confirmed to a primary source."
  },
  "confidence_values": {
    "HIGH": "Confirmed to a primary source; safe to use.",
    "MEDIUM": "Sourced but with a caveat noted in `notes`; confirm at point of use.",
    "LOW": "Weak or single-thread sourcing; must not be used publicly until strengthened."
  },
  "self_commitments": [
    {
      "id": "S1",
      "text": "Every figure in this project carries a source and a confidence flag.",
      "detail": "Self-imposed, in force across all working docs",
      "status": "in force"
    },
    {
      "id": "S2",
      "text": "Publish the pilot's baseline before it starts, no baseline, no claim.",
      "detail": "Commitment, pre-launch",
      "status": "commitment"
    },
    {
      "id": "S3",
      "text": "Publish a 12-month outcomes evaluation, the thing Target 120 never got.",
      "detail": "Commitment, month 12",
      "status": "commitment"
    },
    {
      "id": "S4",
      "text": "Lead with the hardest numbers; concede the soft ones in the open.",
      "detail": "Self-imposed, honesty-flag ledger maintained",
      "status": "in force"
    }
  ],
  "entries": [
    {
      "id": "A1",
      "lens": "A",
      "slug": "robodebt-royal-commission",
      "title": "Robodebt Royal Commission, 57 recs, years to act",
      "what": "57 recommendations on lawful, human-supervised automated decision-making; government accepted or accepted-in-principle 56.",
      "outcome": "As of late 2024 only ~28 reported fully implemented; the rest a multi-year grind that only moves while someone keeps score in public.",
      "status": "PARTIAL",
      "amount": "$1.872bn settlement",
      "year": "2023",
      "source": "Royal Commission into the Robodebt Scheme, Final Report (Holmes AC SC), 7 Jul 2023",
      "confidence": "HIGH",
      "public_use": true,
      "hold_reason": "",
      "notes": ""
    },
    {
      "id": "A2",
      "lens": "A",
      "slug": "aboriginal-deaths-in-custody",
      "title": "Aboriginal Deaths in Custody, 339 recs, still open",
      "what": "The 1991 Royal Commission made 339 recommendations; taxpayers paid for the answers decades ago.",
      "outcome": "Decades on a great many remain unimplemented, with live disputes that official reviews overstated how much had been done.",
      "status": "IGNORED",
      "amount": "",
      "year": "1991, 2021 review",
      "source": "Royal Commission into Aboriginal Deaths in Custody (1991); ANU CIPR",
      "confidence": "HIGH",
      "public_use": true,
      "hold_reason": "",
      "notes": ""
    },
    {
      "id": "A3",
      "lens": "A",
      "slug": "wa-ag-same-weaknesses",
      "title": "WA Auditor General: “same weaknesses, year after year”",
      "what": "The annual Information Systems Audit keeps reissuing the same control-weakness recommendations to agencies.",
      "outcome": "AG: agencies “still not taking action… not taking the risks seriously”, the same warning recurs 2014 to 2017 to 2024 to 2025.",
      "status": "RECURRING",
      "amount": "",
      "year": "2017",
      "source": "WA Auditor General, Information Systems Audit Report 2017 (Caroline Spencer)",
      "confidence": "HIGH",
      "public_use": true,
      "hold_reason": "",
      "notes": ""
    },
    {
      "id": "A4",
      "lens": "A",
      "slug": "wa-ag-2025-65pc-carried-over",
      "title": "WA AG 2025: 65% of IT findings carried over, again",
      "what": "The 2025 IS audit raised 359 control findings across 53 entities; the AG notes many “do not require large technology investments to fix.”",
      "outcome": "65% were unaddressed from prior years and 57% of the most serious remained unresolved, a failure of will, not budget.",
      "status": "RECURRING",
      "amount": "359 findings / 53 entities",
      "year": "2025",
      "source": "WA Auditor General, State Government 2025 Information Systems Audit Results",
      "confidence": "HIGH",
      "public_use": true,
      "hold_reason": "",
      "notes": ""
    },
    {
      "id": "A5",
      "lens": "A",
      "slug": "wa-ag-blowout-tracking-duplication",
      "title": "WA AG told to track blowouts; govt called it “duplication”",
      "what": "The AG recommended transparent tracking of major-project cost and time; in 2022 Finance and Treasury called more reporting “unnecessary duplication.”",
      "outcome": "The AG tracked it anyway, and that same work then found $1.6bn blown out and information “patchy, inconsistent and not transparent.”",
      "status": "IGNORED",
      "amount": "$1.6bn later found",
      "year": "2022 to 2025",
      "source": "WA Auditor General, Transparency Report - Major Projects (2022)",
      "confidence": "HIGH",
      "public_use": true,
      "hold_reason": "",
      "notes": ""
    },
    {
      "id": "B1",
      "lens": "B",
      "slug": "cowaramup-service-station",
      "title": "Cowaramup service station, before an appointed panel, decision pending",
      "what": "A 12-bay petrol station (DAP/26/03096, 2 Peake Street) is before an appointed Development Assessment Panel. More than 100 residents protested in May 2026 over traffic and pedestrian safety. The application is listed on the DAP register as a “convenience store,” though the plans describe a service station.",
      "outcome": "Live, no decision as at 18 July 2026; submissions closed 15 May 2026. Not an override, an open matter. The Nationals say the site is one the Cowaramup Precinct Plan already flags as a pedestrian-safety priority.",
      "status": "LIVE",
      "amount": "",
      "year": "2026",
      "source": "WA DAP register, application DAP/26/03096 (lodged 14 Apr 2026); South Western Times, 13 May 2026; Cowaramup Precinct Plan",
      "confidence": "HIGH",
      "public_use": false,
      "hold_reason": "LIVE: open matter, decision pending. Verified, but do not present as settled or as an override until it is determined. Open matter, decision not yet made. Do not present as an override until the panel determines it.",
      "notes": "Open matter, decision not yet made. Do not present as an override until the panel determines it."
    },
    {
      "id": "B2",
      "lens": "B",
      "slug": "cds-wine-container-deposit",
      "title": "Container deposit scheme (wine), warned, launched anyway",
      "what": "Friends of WA Wine put it in writing: ~$1.15 to 1.25 real cost per bottle vs a 10c refund, ~$11m/yr for under 1% litter gain, no WA glass reprocessor, WA hit a year early. They asked for a pause.",
      "outcome": "Government launched on schedule; the cost lands on regional wine country. The strongest of the four, fully documented, Warren-Blackwood's own back yard.",
      "status": "IGNORED",
      "amount": "~$11m/yr industry cost",
      "year": "2026",
      "source": "Friends of WA Wine submission & Minister meeting (Mar 2026)",
      "confidence": "HIGH",
      "public_use": true,
      "hold_reason": "",
      "notes": ""
    },
    {
      "id": "B3",
      "lens": "B",
      "slug": "west-coast-demersal",
      "title": "West Coast demersal fishing, warned 15 years, brutal patch",
      "what": "The fishery ran on an “interim” plan since 2007; overfishing was on the record ~15 years while fixes stayed too small.",
      "outcome": "Dec 2025: rec fishing shut 21 months, commercial demersal permanently closed, $29.2m package. Frame only as “managed too slowly”, the science was right.",
      "status": "IGNORED",
      "amount": "$29.2m support package",
      "year": "2007 to 2025",